name,description
Machine Learning Básico,Introducción a algoritmos de ML, regresión y clasificación con Python
Python Web Scraping,Técnicas de extracción de datos web con BeautifulSoup y Selenium
Kubernetes Avanzado,Orquestación de contenedores, escalado automático y gestión de clusters
GraphQL Moderno,Consultas eficientes con GraphQL, subscripciones y optimización de APIs
Blockchain y Criptomonedas,Fundamentos de tecnología blockchain y desarrollo de contratos inteligentes
Microservicios con Spring Boot,Arquitectura de microservicios y patrones de comunicación distribuida
